[
  {
    "id": "DVG-0001",
    "concept": "status",
    "variants": [
      { "service": "orders-svc", "behavior_id": "BHV-0001", "description": "order.status: PENDING/CONFIRMED/CANCELLED — order lifecycle" },
      { "service": "billing-svc", "behavior_id": "BHV-0002", "description": "invoice.status: OPEN/CLOSED — invoice lifecycle" }
    ],
    "classification": "false-cognate",
    "decision_owner": "Jane Doe",
    "decided_at": "2026-08-01T12:00:00Z",
    "rationale": "Order status and invoice status are different concepts that happen to share the English word 'status'. They belong to different bounded contexts (Ordering vs Billing) and should not be reconciled into one shared status model.",
    "evidence": [
      { "source": "code", "locator": "services/orders-svc/app.py:8" },
      { "source": "code", "locator": "services/billing-svc/main.go:10" },
      { "source": "test", "locator": "tests/test_orders.py:1" }
    ]
  }
]
