[
  {
    "concept": "status",
    "evidence": [
      {
        "locator": "services/orders-svc/app.py:8",
        "source": "code"
      },
      {
        "locator": "services/billing-svc/main.go:10",
        "source": "code"
      },
      {
        "locator": "tests/test_orders.py:1",
        "source": "test"
      }
    ],
    "id": "DVG-0001",
    "variants": [
      {
        "description": "order.status: PENDING/CONFIRMED/CANCELLED \u2014 order lifecycle",
        "service": "orders-svc"
      },
      {
        "description": "invoice.status: OPEN/CLOSED \u2014 invoice lifecycle",
        "service": "billing-svc"
      },
      {
        "description": "order.status: PENDING/CONFIRMED/CANCELLED",
        "service": "orders-svc"
      },
      {
        "description": "invoice.status: OPEN/CLOSED",
        "service": "billing-svc"
      }
    ]
  }
]
